<?xml version="1.0" encoding="UTF-8"?>
<queue-entries
	xmlns:xsi="http://www.w3.org/2001/XMLSchema-instance"
	xsi:noNamespaceSchemaLocation="queue.xsd">
  <queue>
    <name>default</name>
    <rate>1/s</rate>
  </queue>
  <queue>
    <name>mail-queue</name>
    <rate>2000/d</rate>
    <bucket-size>10</bucket-size>
  </queue>
  <queue>
    <name>background-processing</name>
    <rate>5/s</rate>
  </queue>
</queue-entries>
